{
  "schema_version": "0.1.0",
  "event_id": "9769268e-6ed3-4f9c-a7e2-6abc050e5551",
  "captured_at": "2026-10-30T00:00:00Z",
  "observed_at": null,
  "synthetic": true,
  "source": {
    "kind": "runtime",
    "adapter_id": "synthetic-runtime-adapter",
    "adapter_version": "0.0.0-initialization",
    "platform": "unknown",
    "freshness": "unknown"
  },
  "game": {
    "product": "FM27",
    "build": null,
    "session_id": null,
    "game_time": null
  },
  "status": "unavailable",
  "payload": {
    "kind": "capability_report",
    "capabilities": [
      {
        "id": "runtime-observation",
        "status": "not_probed",
        "detail": "纯合成初始化例子；尚未检查游戏文件或读取存档。"
      }
    ]
  }
}
